[
  {
    "description": "Cut taxes on first-time home buyers",
    "quote": "We saw that homes are getting too expensive especially for younger Canadians uh to buy them that starting out. So we cut taxes on them on first-time home buyers.",
    "category": "Housing",
    "confidence_level": "High",
    "transcript_id": "27eJz91LAi4",
    "transcript_title": "Liberal Leader Mark Carney holds a rally in Kitchener, Ont. \u2013 March 26, 2025",
    "transcript_date": "2025-03-27",
    "transcript_url": "https://www.youtube.com/watch?v=27eJz91LAi4",
    "timestamp": "00:05:32",
    "timestamp_seconds": 332,
    "timestamp_url": "https://www.youtube.com/watch?v=27eJz91LAi4&t=332s"
  },
  {
    "description": "Eliminate capital gains tax hike",
    "quote": "We saw that the capital gains tax hike was stifling builders and innovators and entrepreneurs. So we got rid of that.",
    "category": "Economy",
    "confidence_level": "High",
    "transcript_id": "27eJz91LAi4",
    "transcript_title": "Liberal Leader Mark Carney holds a rally in Kitchener, Ont. \u2013 March 26, 2025",
    "transcript_date": "2025-03-27",
    "transcript_url": "https://www.youtube.com/watch?v=27eJz91LAi4",
    "timestamp": "00:05:55",
    "timestamp_seconds": 355,
    "timestamp_url": "https://www.youtube.com/watch?v=27eJz91LAi4&t=355s"
  },
  {
    "description": "Eliminate consumer carbon tax",
    "quote": "We knew that the consumer carbon tax which looked good on paper had become too divisive and we eliminated it on day one.",
    "category": "Environment",
    "confidence_level": "High",
    "transcript_id": "27eJz91LAi4",
    "transcript_title": "Liberal Leader Mark Carney holds a rally in Kitchener, Ont. \u2013 March 26, 2025",
    "transcript_date": "2025-03-27",
    "transcript_url": "https://www.youtube.com/watch?v=27eJz91LAi4",
    "timestamp": "00:06:08",
    "timestamp_seconds": 368,
    "timestamp_url": "https://www.youtube.com/watch?v=27eJz91LAi4&t=368s"
  },
  {
    "description": "Expand Liberal dental care plan",
    "quote": "We expanded the Liberal dental care plan last week to cover an additional 5 million Canadians.",
    "category": "Healthcare",
    "confidence_level": "High",
    "transcript_id": "27eJz91LAi4",
    "transcript_title": "Liberal Leader Mark Carney holds a rally in Kitchener, Ont. \u2013 March 26, 2025",
    "transcript_date": "2025-03-27",
    "transcript_url": "https://www.youtube.com/watch?v=27eJz91LAi4",
    "timestamp": "00:06:21",
    "timestamp_seconds": 381,
    "timestamp_url": "https://www.youtube.com/watch?v=27eJz91LAi4&t=381s"
  },
  {
    "description": "Strengthen trade partnerships with Europe and the UK",
    "quote": "In my first week I went to Paris and London to strengthen our trade partnerships with Europe and the UK.",
    "category": "Economy",
    "confidence_level": "High",
    "transcript_id": "27eJz91LAi4",
    "transcript_title": "Liberal Leader Mark Carney holds a rally in Kitchener, Ont. \u2013 March 26, 2025",
    "transcript_date": "2025-03-27",
    "transcript_url": "https://www.youtube.com/watch?v=27eJz91LAi4",
    "timestamp": "00:07:38",
    "timestamp_seconds": 458,
    "timestamp_url": "https://www.youtube.com/watch?v=27eJz91LAi4&t=458s"
  },
  {
    "description": "New defense agreement with Australia, France, and the UK",
    "quote": "We struck a new defense agreement with Australia to reinforce and our security with the French and the UK.",
    "category": "Defense",
    "confidence_level": "High",
    "transcript_id": "27eJz91LAi4",
    "transcript_title": "Liberal Leader Mark Carney holds a rally in Kitchener, Ont. \u2013 March 26, 2025",
    "transcript_date": "2025-03-27",
    "transcript_url": "https://www.youtube.com/watch?v=27eJz91LAi4",
    "timestamp": "00:07:51",
    "timestamp_seconds": 471,
    "timestamp_url": "https://www.youtube.com/watch?v=27eJz91LAi4&t=471s"
  },
  {
    "description": "Unlock major infrastructure projects and build Canada into an energy superpower",
    "quote": "We are unlocking major infrastructure projects. We are going to build Canada into an energy superpower in both conventional and clean energy.",
    "category": "Economy",
    "confidence_level": "High",
    "transcript_id": "27eJz91LAi4",
    "transcript_title": "Liberal Leader Mark Carney holds a rally in Kitchener, Ont. \u2013 March 26, 2025",
    "transcript_date": "2025-03-27",
    "transcript_url": "https://www.youtube.com/watch?v=27eJz91LAi4",
    "timestamp": "00:08:14",
    "timestamp_seconds": 494,
    "timestamp_url": "https://www.youtube.com/watch?v=27eJz91LAi4&t=494s"
  },
  {
    "description": "Eliminate duplicative federal regulations and promote free trade within Canada",
    "quote": "We put on the table that we're getting rid of a bunch of duplicative federal regulations. We're going to have a principle of one project one review and in exchange they're going to agree to eliminate all the barriers to trade and labor mobility in this country.",
    "category": "Economy",
    "confidence_level": "High",
    "transcript_id": "27eJz91LAi4",
    "transcript_title": "Liberal Leader Mark Carney holds a rally in Kitchener, Ont. \u2013 March 26, 2025",
    "transcript_date": "2025-03-27",
    "transcript_url": "https://www.youtube.com/watch?v=27eJz91LAi4",
    "timestamp": "00:08:48",
    "timestamp_seconds": 528,
    "timestamp_url": "https://www.youtube.com/watch?v=27eJz91LAi4&t=528s"
  },
  {
    "description": "Commit retaliatory tariffs revenue to protect Canadian workers",
    "quote": "My government is committed to put every single dollar that we collect from retaliatory tariffs against the Americans. We're going to put every dollar to protect our workers.",
    "category": "Economy",
    "confidence_level": "High",
    "transcript_id": "27eJz91LAi4",
    "transcript_title": "Liberal Leader Mark Carney holds a rally in Kitchener, Ont. \u2013 March 26, 2025",
    "transcript_date": "2025-03-27",
    "transcript_url": "https://www.youtube.com/watch?v=27eJz91LAi4",
    "timestamp": "00:13:12",
    "timestamp_seconds": 792,
    "timestamp_url": "https://www.youtube.com/watch?v=27eJz91LAi4&t=792s"
  },
  {
    "description": "Build millions of homes and make Canada an energy superpower",
    "quote": "A plan that builds millions of homes. That builds Canada into an energy superpower.",
    "category": "Housing",
    "confidence_level": "High",
    "transcript_id": "27eJz91LAi4",
    "transcript_title": "Liberal Leader Mark Carney holds a rally in Kitchener, Ont. \u2013 March 26, 2025",
    "transcript_date": "2025-03-27",
    "transcript_url": "https://www.youtube.com/watch?v=27eJz91LAi4",
    "timestamp": "00:25:07",
    "timestamp_seconds": 1507,
    "timestamp_url": "https://www.youtube.com/watch?v=27eJz91LAi4&t=1507s"
  },
  {
    "description": "Create one Canadian economy",
    "quote": "A plan that creates one Canadian economy and not 13 that puts more money in your pockets and builds the strongest economy in the G7.",
    "category": "Economy",
    "confidence_level": "High",
    "transcript_id": "27eJz91LAi4",
    "transcript_title": "Liberal Leader Mark Carney holds a rally in Kitchener, Ont. \u2013 March 26, 2025",
    "transcript_date": "2025-03-27",
    "transcript_url": "https://www.youtube.com/watch?v=27eJz91LAi4",
    "timestamp": "00:25:17",
    "timestamp_seconds": 1517,
    "timestamp_url": "https://www.youtube.com/watch?v=27eJz91LAi4&t=1517s"
  },
  {
    "description": "Creation of a $2 billion Strategic Response Fund to protect jobs in the auto sector affected by U.S. tariffs.",
    "quote": "That is why today I'm announcing that the new liberal government will create the Strategic response fund and this is a $2 billion fund that will protect the jobs of workers affected by President Trump's tariffs.",
    "category": "Economy",
    "confidence_level": "High",
    "transcript_id": "3N4FF8KiyE8",
    "transcript_title": "Mark Carney proposes new fund to protect auto sector impacted by U.S. tariffs \u2013 March 26, 2025",
    "transcript_date": "2025-03-26",
    "transcript_url": "https://www.youtube.com/watch?v=3N4FF8KiyE8",
    "timestamp": "00:06:00",
    "timestamp_seconds": 360,
    "timestamp_url": "https://www.youtube.com/watch?v=3N4FF8KiyE8&t=360s"
  },
  {
    "description": "Commitment to use all revenues from retaliatory tariffs against the United States to support Canadian workers.",
    "quote": "That's why our new government has committed to use all of the revenues from our retaliatory tariffs against the United States use all of those revenues to support Canadian workers.",
    "category": "Economy",
    "confidence_level": "High",
    "transcript_id": "3N4FF8KiyE8",
    "transcript_title": "Mark Carney proposes new fund to protect auto sector impacted by U.S. tariffs \u2013 March 26, 2025",
    "transcript_date": "2025-03-26",
    "transcript_url": "https://www.youtube.com/watch?v=3N4FF8KiyE8",
    "timestamp": "00:06:00",
    "timestamp_seconds": 360,
    "timestamp_url": "https://www.youtube.com/watch?v=3N4FF8KiyE8&t=360s"
  },
  {
    "description": "Implementation of a middle-class tax cut to save a two-income family up to $825 a year.",
    "quote": "I have announced that a new liberal government will put more money in Canadians Pockets through a middle class tax cut a tax cut that will save a two-income family up to $825 a year.",
    "category": "Economy",
    "confidence_level": "High",
    "transcript_id": "3N4FF8KiyE8",
    "transcript_title": "Mark Carney proposes new fund to protect auto sector impacted by U.S. tariffs \u2013 March 26, 2025",
    "transcript_date": "2025-03-26",
    "transcript_url": "https://www.youtube.com/watch?v=3N4FF8KiyE8",
    "timestamp": "00:06:00",
    "timestamp_seconds": 360,
    "timestamp_url": "https://www.youtube.com/watch?v=3N4FF8KiyE8&t=360s"
  },
  {
    "description": "Creation of $10 a day childcare for hardworking families.",